{"elements":[{"asset_path":null,"bbox":[100,100,800,120],"id":"title","kind":"title","motion_capabilities":["reveal","highlight"],"role":"headline","text":"标题","z_index":1}],"fallback_preview_path":null,"height":1080,"page_id":"page-1","quality":{"score":1,"warnings":[]},"render_mode":"native","schema_version":1,"visual_style":{"colors":[],"font_families":[],"theme_id":"core01"},"width":1920}